{
  "abstract": "scripts/opcodes/PRINCEv2/prince_v2_optimized3.js at pinned commit b931a6711ab332fd5923e708c869bed02e39984e.",
  "authors": [
    "BitVM/bitvm-js opcode scripts"
  ],
  "bitcoin_topics": [
    "Bitcoin-Script",
    "BitVM",
    "opcodes"
  ],
  "canonical_url": "https://github.com/BitVM/bitvm-js/blob/b931a6711ab332fd5923e708c869bed02e39984e/scripts/opcodes/PRINCEv2/prince_v2_optimized3.js",
  "collection": "bitvm-opcodes",
  "content_file": "bitvm-opcodes-scripts-opcodes-princev2-prince-v2-optimized3-js-316c6d64f3.md",
  "id": "bitvm-opcodes-scripts-opcodes-princev2-prince-v2-optimized3-js-316c6d64f3",
  "license": "No repository LICENSE or COPYING file was detected at the pinned commit. No reuse or redistribution license is asserted; individual file notices, if any, continue to apply.",
  "provenance": {
    "content_kind": "source-text",
    "is_sample": false,
    "notes": "Incremental bounded ingestion; see library/source-registry.json and library/ingestion/latest-report.json.",
    "source_license": "No repository LICENSE or COPYING file was detected at the pinned commit. No reuse or redistribution license is asserted; individual file notices, if any, continue to apply."
  },
  "published_at": "2026-08-24",
  "retrieval": {
    "commit": "b931a6711ab332fd5923e708c869bed02e39984e",
    "content_type": "text/plain",
    "fetcher_version": "1.0.0",
    "method": "public-git",
    "path": "scripts/opcodes/PRINCEv2/prince_v2_optimized3.js",
    "raw_file": "raw/bitvm-opcodes/bitvm-opcodes-scripts-opcodes-princev2-prince-v2-optimized3-js-316c6d64f3.js",
    "repository": "https://github.com/BitVM/bitvm-js.git",
    "retrieved_at": "2026-08-24T21:53:24Z",
    "sha256": "14a1f921bef57175721031f9f928c08940561e4cfa8a7f4b38e98d5859d89901"
  },
  "retrieved_at": "2026-08-24",
  "schema_version": "1.0.0",
  "source_manifest": "manifests/bitvm-opcodes.json",
  "source_type": "source-code",
  "tags": [
    "BitVM",
    "opcodes",
    "source-code",
    "public-source",
    "ingested"
  ],
  "title": "scripts/opcodes/PRINCEv2/prince_v2_optimized3.js"
}
