{
  "abstract": "fairgate whitepaper Source: https://fairgate.io/assets/fairgate-whitepaper.pdf Retrieved: 2026-08-24T21:53:00Z Extraction note: pdftotext was not installed; the PDF is retained and indexed by title/provenance only. --- PDF retained in the raw source directory.",
  "authors": [
    "Fairgate research"
  ],
  "bitcoin_topics": [
    "BitVMX",
    "BitVM",
    "bridges"
  ],
  "canonical_url": "https://fairgate.io/assets/fairgate-whitepaper.pdf",
  "collection": "fairgate",
  "content_file": "fairgate-fairgate-whitepaper-c1e758a1ac.md",
  "id": "fairgate-fairgate-whitepaper-c1e758a1ac",
  "license": "Public resources remain copyrighted by Fairgate or named authors unless an item states a license. No redistribution license is asserted.",
  "provenance": {
    "content_kind": "source-text",
    "is_sample": false,
    "notes": "Incremental bounded ingestion; see library/source-registry.json and library/ingestion/latest-report.json.",
    "source_license": "Public resources remain copyrighted by Fairgate or named authors unless an item states a license. No redistribution license is asserted."
  },
  "published_at": "2026-08-24",
  "retrieval": {
    "content_type": "application/pdf",
    "fetched_url": "https://fairgate.io/assets/fairgate-whitepaper.pdf",
    "fetcher_version": "1.0.0",
    "http_status": 200,
    "method": "public-http",
    "raw_file": "raw/fairgate/fairgate-fairgate-whitepaper-c1e758a1ac.pdf",
    "retrieved_at": "2026-08-24T21:53:00Z",
    "sha256": "bcab785a6d2e3a65c41f0df604a6b5bda0b5598d2ed218b840e81eb276741f63"
  },
  "retrieved_at": "2026-08-24",
  "schema_version": "1.0.0",
  "source_manifest": "manifests/fairgate.json",
  "source_type": "paper",
  "tags": [
    "fairgate",
    "bitcoin-research",
    "public-source",
    "ingested"
  ],
  "title": "fairgate whitepaper"
}
