{
  "abstract": "Subchains: an embedded blockchain whose blocks are published inside Bitcoin blocks",
  "authors": [
    "RobinLinus"
  ],
  "bitcoin_topics": [
    "Bitcoin",
    "cryptography",
    "prototypes"
  ],
  "canonical_url": "https://gist.github.com/RobinLinus/3c9c91f701a420c13f90b1c70616e77a#file-thikcs-subchains-md",
  "collection": "robinlinus-gists",
  "content_file": "robinlinus-gists-subchains-an-embedded-blockchain-whose-blocks-are-published-in-209b0fa4ad.md",
  "id": "robinlinus-gists-subchains-an-embedded-blockchain-whose-blocks-are-published-in-209b0fa4ad",
  "license": "Public gists have no implied open-source license. Preserve author, canonical gist URL, revision, and filename; no redistribution license is asserted unless a gist states one.",
  "provenance": {
    "content_kind": "source-text",
    "is_sample": false,
    "notes": "Incremental bounded ingestion; see library/source-registry.json and library/ingestion/latest-report.json.",
    "source_license": "Public gists have no implied open-source license. Preserve author, canonical gist URL, revision, and filename; no redistribution license is asserted unless a gist states one."
  },
  "published_at": "2026-08-24",
  "retrieval": {
    "content_type": "text/markdown",
    "fetched_url": "https://api.github.com/gists/3c9c91f701a420c13f90b1c70616e77a",
    "fetcher_version": "1.0.0",
    "http_status": 200,
    "method": "public-api",
    "path": "thikcs-subchains.md",
    "raw_file": "raw/robinlinus-gists/robinlinus-gists-subchains-an-embedded-blockchain-whose-blocks-are-published-in-209b0fa4ad.md",
    "retrieved_at": "2026-08-24T21:53:25Z",
    "revision": "94dd8f6b11a335201f08cb9bbb2a67b9a0592f3e",
    "sha256": "680e9b7c3898a56254d55b7be15066bc8a6860aaa9771b92c3c535c29946ccc3"
  },
  "retrieved_at": "2026-08-24",
  "schema_version": "1.0.0",
  "source_manifest": "manifests/robinlinus-gists.json",
  "source_type": "source-code",
  "tags": [
    "robin-linus",
    "github-gist",
    "source-code",
    "public-source",
    "ingested"
  ],
  "title": "Subchains: an embedded blockchain whose blocks are published inside Bitcoin blocks / thikcs-subchains.md"
}
