{
  "abstract": "README.md at pinned commit b931a6711ab332fd5923e708c869bed02e39984e.",
  "authors": [
    "BitVM/bitvm-js opcode scripts"
  ],
  "bitcoin_topics": [
    "Bitcoin-Script",
    "BitVM",
    "opcodes"
  ],
  "canonical_url": "https://github.com/BitVM/bitvm-js/blob/b931a6711ab332fd5923e708c869bed02e39984e/README.md",
  "collection": "bitvm-opcodes",
  "content_file": "bitvm-opcodes-readme-md-fb2d0fbc73.md",
  "id": "bitvm-opcodes-readme-md-fb2d0fbc73",
  "license": "No repository LICENSE or COPYING file was detected at the pinned commit. No reuse or redistribution license is asserted; individual file notices, if any, continue to apply.",
  "provenance": {
    "content_kind": "source-text",
    "is_sample": false,
    "notes": "Incremental bounded ingestion; see library/source-registry.json and library/ingestion/latest-report.json.",
    "source_license": "No repository LICENSE or COPYING file was detected at the pinned commit. No reuse or redistribution license is asserted; individual file notices, if any, continue to apply."
  },
  "published_at": "2026-08-24",
  "retrieval": {
    "commit": "b931a6711ab332fd5923e708c869bed02e39984e",
    "content_type": "text/plain",
    "fetcher_version": "1.0.0",
    "method": "public-git",
    "path": "README.md",
    "raw_file": "raw/bitvm-opcodes/bitvm-opcodes-readme-md-fb2d0fbc73.md",
    "repository": "https://github.com/BitVM/bitvm-js.git",
    "retrieved_at": "2026-08-24T21:53:24Z",
    "sha256": "dc76747ec600cd610bbad55eca7fb7109c5404e44c85836d2ec4f49030b085f8"
  },
  "retrieved_at": "2026-08-24",
  "schema_version": "1.0.0",
  "source_manifest": "manifests/bitvm-opcodes.json",
  "source_type": "source-code",
  "tags": [
    "BitVM",
    "opcodes",
    "source-code",
    "public-source",
    "ingested"
  ],
  "title": "README.md"
}
