{
  "abstract": "color customization for https://gnusha.org/pi/bitcoindev/ Source: https://gnusha.org/pi/bitcoindev/ /text/color/ Retrieved: 2026-08-24T21:52:29Z --- public inbox for bitcoindev@googlegroups.com help / color / mirror / Atom feed color customization for https://gnusha.org/pi/bitcoindev/ public-inbox provides a stable set of CSS classes for users to customize colors for highlighting diffs and code. Users of browsers such as dillo, Firefox, or some browser extensions may start by downloading the following sample CSS file to control the colors they see: https://gnusha.org/pi/bitcoindev/userContent.",
  "authors": [
    "Bitcoin development mailing lists"
  ],
  "bitcoin_topics": [
    "protocol-development",
    "consensus",
    "relay-policy"
  ],
  "canonical_url": "https://gnusha.org/pi/bitcoindev/_/text/color/",
  "collection": "mailing-lists",
  "content_file": "bitcoin-mailing-lists-color-customization-for-https-gnusha-org-pi-bitcoindev-50f8bb1fc3.md",
  "id": "bitcoin-mailing-lists-color-customization-for-https-gnusha-org-pi-bitcoindev-50f8bb1fc3",
  "license": "Public author-owned correspondence; retain source attribution and canonical archive URL. No redistribution license is asserted.",
  "provenance": {
    "content_kind": "source-text",
    "is_sample": false,
    "notes": "Incremental bounded ingestion; see library/source-registry.json and library/ingestion/latest-report.json.",
    "source_license": "Public author-owned correspondence; retain source attribution and canonical archive URL. No redistribution license is asserted."
  },
  "published_at": "2026-08-24",
  "retrieval": {
    "content_type": "text/html",
    "fetched_url": "https://gnusha.org/pi/bitcoindev/_/text/color/",
    "fetcher_version": "1.0.0",
    "http_status": 200,
    "method": "public-http",
    "raw_file": "raw/bitcoin-mailing-lists/bitcoin-mailing-lists-color-customization-for-https-gnusha-org-pi-bitcoindev-50f8bb1fc3.html",
    "retrieved_at": "2026-08-24T21:52:29Z",
    "sha256": "e8d3a37ecec9b57fff9fce6250f42f5b47cf4f2be42dafc0a2763b033ba938aa"
  },
  "retrieved_at": "2026-08-24",
  "schema_version": "1.0.0",
  "source_manifest": "manifests/bitcoin-mailing-lists.json",
  "source_type": "mailing-list-thread",
  "tags": [
    "bitcoin-dev",
    "mailing-list",
    "protocol-development",
    "public-source",
    "ingested"
  ],
  "title": "color customization for https://gnusha.org/pi/bitcoindev/"
}
