{
  "abstract": "Promising Examples of Real-World Bitcoin Payment Adoption",
  "authors": [
    "RobinLinus"
  ],
  "bitcoin_topics": [
    "Bitcoin",
    "cryptography",
    "prototypes"
  ],
  "canonical_url": "https://gist.github.com/RobinLinus/1b0abfa9140e3412f4bc25b669e2eee6#file-real-world-adoption-md",
  "collection": "robinlinus-gists",
  "content_file": "robinlinus-gists-promising-examples-of-real-world-bitcoin-payment-adoption-real-35bc11ad26.md",
  "id": "robinlinus-gists-promising-examples-of-real-world-bitcoin-payment-adoption-real-35bc11ad26",
  "license": "Public gists have no implied open-source license. Preserve author, canonical gist URL, revision, and filename; no redistribution license is asserted unless a gist states one.",
  "provenance": {
    "content_kind": "source-text",
    "is_sample": false,
    "notes": "Incremental bounded ingestion; see library/source-registry.json and library/ingestion/latest-report.json.",
    "source_license": "Public gists have no implied open-source license. Preserve author, canonical gist URL, revision, and filename; no redistribution license is asserted unless a gist states one."
  },
  "published_at": "2026-08-24",
  "retrieval": {
    "content_type": "text/markdown",
    "fetched_url": "https://api.github.com/gists/1b0abfa9140e3412f4bc25b669e2eee6",
    "fetcher_version": "1.0.0",
    "http_status": 200,
    "method": "public-api",
    "path": "real-world-adoption.md",
    "raw_file": "raw/robinlinus-gists/robinlinus-gists-promising-examples-of-real-world-bitcoin-payment-adoption-real-35bc11ad26.md",
    "retrieved_at": "2026-08-24T21:53:25Z",
    "revision": "8c29ca92e58b2f434030f5deae08e2114de78df6",
    "sha256": "4082ed9cbe1fa8390a67d3dedcd712035f163c53888e2a1841da983d24b35905"
  },
  "retrieved_at": "2026-08-24",
  "schema_version": "1.0.0",
  "source_manifest": "manifests/robinlinus-gists.json",
  "source_type": "source-code",
  "tags": [
    "robin-linus",
    "github-gist",
    "source-code",
    "public-source",
    "ingested"
  ],
  "title": "Promising Examples of Real-World Bitcoin Payment Adoption / real-world-adoption.md"
}
