{
  "abstract": "TL;DR | Citrea Source: https://docs.citrea.xyz/essentials/introduction Retrieved: 2026-08-24T21:53:35Z --- Citrea \u2318 Ctrl k Website Blog Join The Community More Citrea \ud83d\udc4b Welcome Getting started Chain Information - Quickstart Bridge to Citrea \ud83d\udd0e Essentials TL;DR Architecture and Transaction Lifecycle Clementine: trust-minimized Bitcoin Bridge Using Clementine Execution Environment Security Properties Transaction Finality \ud83e\ude99 CTR Token Overview Staking & Governance Supply & Allocations \ud83d\udcd6 Developer Documentation Kickstart Chain Information Citrea USD: ctUSD CTR & xCTR Canonical Contract Addresses Can",
  "authors": [
    "Citrea documentation"
  ],
  "bitcoin_topics": [
    "Bitcoin-rollups",
    "zero-knowledge-proofs",
    "bridges"
  ],
  "canonical_url": "https://docs.citrea.xyz/essentials/introduction",
  "collection": "citrea-docs",
  "content_file": "citrea-docs-tl-dr-citrea-c08e3174d5.md",
  "id": "citrea-docs-tl-dr-citrea-c08e3174d5",
  "license": "Public documentation remains copyrighted by Citrea or named authors unless a page states a license. No redistribution license is asserted.",
  "provenance": {
    "content_kind": "source-text",
    "is_sample": false,
    "notes": "Incremental bounded ingestion; see library/source-registry.json and library/ingestion/latest-report.json.",
    "source_license": "Public documentation remains copyrighted by Citrea or named authors unless a page states a license. No redistribution license is asserted."
  },
  "published_at": "2026-08-24",
  "retrieval": {
    "content_type": "text/html",
    "fetched_url": "https://docs.citrea.xyz/essentials/introduction",
    "fetcher_version": "1.0.0",
    "http_status": 200,
    "method": "public-http",
    "raw_file": "raw/citrea-docs/citrea-docs-tl-dr-citrea-c08e3174d5.html",
    "retrieved_at": "2026-08-24T21:53:35Z",
    "sha256": "d2444cc6d7e4cfc742339e472ed5789992e88e84f7eba6072c2d85fee2ee97ea"
  },
  "retrieved_at": "2026-08-24",
  "schema_version": "1.0.0",
  "source_manifest": "manifests/citrea-docs.json",
  "source_type": "article",
  "tags": [
    "citrea",
    "documentation",
    "bitcoin-rollups",
    "public-source",
    "ingested"
  ],
  "title": "TL;DR | Citrea"
}
