{
  "abstract": "Early research efforts at Alpen Labs",
  "authors": [
    "Alpen Labs research"
  ],
  "bitcoin_topics": [
    "Bitcoin-rollups",
    "zero-knowledge-proofs",
    "verification"
  ],
  "canonical_url": "https://www.alpen.org/blog/proof-of-work",
  "collection": "alpen",
  "content_file": "alpen-proof-of-work-1a519d7d64.md",
  "id": "alpen-proof-of-work-1a519d7d64",
  "license": "Public articles remain copyrighted by Alpen Labs or named authors unless an item states a license. No redistribution license is asserted.",
  "provenance": {
    "content_kind": "source-text",
    "is_sample": false,
    "notes": "Incremental bounded ingestion; see library/source-registry.json and library/ingestion/latest-report.json.",
    "source_license": "Public articles remain copyrighted by Alpen Labs or named authors unless an item states a license. No redistribution license is asserted."
  },
  "published_at": "2026-08-24",
  "retrieval": {
    "content_type": "text/html",
    "fetched_url": "https://www.alpen.org/blog/proof-of-work",
    "fetcher_version": "1.0.0",
    "http_status": 200,
    "method": "public-http",
    "raw_file": "raw/alpen/alpen-proof-of-work-1a519d7d64.html",
    "retrieved_at": "2026-08-24T21:53:09Z",
    "sha256": "4a48f4afe9ce8edd942b51f2aa13b473ce8a881042727df815d1e9175082ce7c"
  },
  "retrieved_at": "2026-08-24",
  "schema_version": "1.0.0",
  "source_manifest": "manifests/alpen.json",
  "source_type": "article",
  "tags": [
    "alpen-labs",
    "bitcoin-research",
    "public-source",
    "ingested"
  ],
  "title": "Proof of Work"
}
